<?xml version="1.0" encoding="UTF-8"?>
<!--
  Copyright 2017 United States Government as represented by the
  Administrator of the National Aeronautics and Space Administration.
  All Rights Reserved.
  
  This file is available under the terms of the NASA Open Source Agreement
  (NOSA). You should have received a copy of this agreement with the
  Kepler source code; see the file NASA-OPEN-SOURCE-AGREEMENT.doc.
  
  No Warranty: THE SUBJECT SOFTWARE IS PROVIDED "AS IS" WITHOUT ANY
  WARRANTY OF ANY KIND, EITHER EXPRESSED, IMPLIED, OR STATUTORY,
  INCLUDING, BUT NOT LIMITED TO, ANY WARRANTY THAT THE SUBJECT SOFTWARE
  WILL CONFORM TO SPECIFICATIONS, ANY IMPLIED WARRANTIES OF
  MERCHANTABILITY, FITNESS FOR A PARTICULAR PURPOSE, OR FREEDOM FROM
  INFRINGEMENT, ANY WARRANTY THAT THE SUBJECT SOFTWARE WILL BE ERROR
  FREE, OR ANY WARRANTY THAT DOCUMENTATION, IF PROVIDED, WILL CONFORM
  TO THE SUBJECT SOFTWARE. THIS AGREEMENT DOES NOT, IN ANY MANNER,
  CONSTITUTE AN ENDORSEMENT BY GOVERNMENT AGENCY OR ANY PRIOR RECIPIENT
  OF ANY RESULTS, RESULTING DESIGNS, HARDWARE, SOFTWARE PRODUCTS OR ANY
  OTHER APPLICATIONS RESULTING FROM USE OF THE SUBJECT SOFTWARE.
  FURTHER, GOVERNMENT AGENCY DISCLAIMS ALL WARRANTIES AND LIABILITIES
  REGARDING THIRD-PARTY SOFTWARE, IF PRESENT IN THE ORIGINAL SOFTWARE,
  AND DISTRIBUTES IT "AS IS."

  Waiver and Indemnity: RECIPIENT AGREES TO WAIVE ANY AND ALL CLAIMS
  AGAINST THE UNITED STATES GOVERNMENT, ITS CONTRACTORS AND
  SUBCONTRACTORS, AS WELL AS ANY PRIOR RECIPIENT. IF RECIPIENT'S USE OF
  THE SUBJECT SOFTWARE RESULTS IN ANY LIABILITIES, DEMANDS, DAMAGES,
  EXPENSES OR LOSSES ARISING FROM SUCH USE, INCLUDING ANY DAMAGES FROM
  PRODUCTS BASED ON, OR RESULTING FROM, RECIPIENT'S USE OF THE SUBJECT
  SOFTWARE, RECIPIENT SHALL INDEMNIFY AND HOLD HARMLESS THE UNITED
  STATES GOVERNMENT, ITS CONTRACTORS AND SUBCONTRACTORS, AS WELL AS ANY
  PRIOR RECIPIENT, TO THE EXTENT PERMITTED BY LAW. RECIPIENT'S SOLE
  REMEDY FOR ANY SUCH MATTER SHALL BE THE IMMEDIATE, UNILATERAL
  TERMINATION OF THIS AGREEMENT.
-->

<!--  This schema is used by the KTC verification tool. -->
<xsd:schema xmlns:xsd="http://www.w3.org/2001/XMLSchema"
    targetNamespace="http://kepler.nasa.gov/ar/xmlbean"
    xmlns="http://kepler.nasa.gov/ar/xmlbean"
    elementFormDefault="qualified">
    
    <xsd:simpleType name="TargetTableTypeXB">
      <xsd:restriction base="xsd:string">
        <xsd:enumeration value="SC" />
        <xsd:enumeration value="LC" />
      </xsd:restriction>
    </xsd:simpleType>
    
    <xsd:simpleType name="QuarterTypeXB">
      <xsd:restriction base="xsd:integer">
        <xsd:minInclusive value="0" />
        <xsd:maxInclusive value="24" />
      </xsd:restriction>
    </xsd:simpleType>
    
    <xsd:simpleType name="MonthInQuarterTypeXB">
      <xsd:restriction base="xsd:integer">
        <xsd:minInclusive value="1"/>
        <xsd:maxInclusive value="3"/>
      </xsd:restriction>
    </xsd:simpleType>
    
    <xsd:complexType name="ExpectedTargetListXB">
      <xsd:attribute name="category" type="xsd:string"  use="required" />
      <xsd:attribute name="fileName" type="xsd:string" use="required" />
    </xsd:complexType>
    
    <xsd:complexType name="ExpectedTargetTableInformationXB">
      <xsd:sequence>
         <xsd:element name="targetList" type="ExpectedTargetListXB" minOccurs="0" maxOccurs="unbounded" />
      </xsd:sequence>
      <xsd:attribute name="quarter"         type="QuarterTypeXB"        use="required" />
      <xsd:attribute name="month"           type="MonthInQuarterTypeXB" use="optional" />
      <xsd:attribute name="externalId"      type="xsd:short"            use="required" />
      <xsd:attribute name="plannedStart"    type="xsd:date"             use="required" />
      <xsd:attribute name="plannedEnd"      type="xsd:date"             use="required" />
      <xsd:attribute name="actualStartMjd"  type="xsd:double"           use="optional" />
      <xsd:attribute name="actualEndMjd"    type="xsd:double"           use="optional" />
      <xsd:attribute name="targetTableType" type="TargetTableTypeXB"    use="required" />
      <xsd:attribute name="startCadence"    type="xsd:integer"          use="optional" />
      <xsd:attribute name="endCadence"      type="xsd:integer"          use="optional" />
    </xsd:complexType>
    
    <xsd:complexType name="ExpectedTargetTableInformationListXB">
      <xsd:sequence>
        <xsd:element name="expectedTargetTableInfo" type="ExpectedTargetTableInformationXB" maxOccurs="unbounded" />
      </xsd:sequence>
    </xsd:complexType>
    
    <xsd:element name="KtcVerifierInfo" type="ExpectedTargetTableInformationListXB" />
</xsd:schema>